{
  "case_id": "design_specification_008",
  "task_type": "design_specification",
  "web_policy": "closed_env",
  "target_image_type": "saas_web_leaderboard_banner",
  "difficulty": "hard",
  "env_files": [
    {
      "path": "env/latest_update.md",
      "role": "Highest-priority current campaign update, priority order, final copy, and replacements",
      "format": "md",
      "origin": "generated",
      "reproducibility_note": "Generated by design_specification_case_generator.py"
    },
    {
      "path": "env/platform_specs.txt",
      "role": "Current platform size, aspect ratio, safe zones, text density, and placement constraints",
      "format": "txt",
      "origin": "generated",
      "reproducibility_note": "Generated by design_specification_case_generator.py"
    },
    {
      "path": "env/visual_rules.json",
      "role": "Current palette, layout rules, hero requirements, conditionals, and forbidden styles",
      "format": "json",
      "origin": "generated",
      "reproducibility_note": "Generated by design_specification_case_generator.py"
    },
    {
      "path": "env/asset_manifest.json",
      "role": "Allowed and restricted candidate assets with campaign and usage constraints",
      "format": "json",
      "origin": "generated",
      "reproducibility_note": "Generated by design_specification_case_generator.py"
    },
    {
      "path": "env/deprecated_assets.json",
      "role": "Old copy, old platform specs, old logo, old claims, and prohibited visual directions",
      "format": "json",
      "origin": "generated",
      "reproducibility_note": "Generated by design_specification_case_generator.py"
    },
    {
      "path": "env/product_messaging.md",
      "role": "B2B SaaS messaging and claim boundaries",
      "format": "md",
      "origin": "generated",
      "reproducibility_note": "Generated by design_specification_case_generator.py"
    }
  ],
  "source_policy": {
    "agent_visible_files": [
      "env/",
      "task.md"
    ],
    "evaluator_only_files": [
      "metadata.json",
      "expected_facts.json",
      "scoring_checklist.json"
    ],
    "web_usage_note": "Closed-env case: solve only from env files and task.md; do not use the web."
  },
  "notes": "Generated design_specification case: domain=saas; platform=Web leaderboard banner; strength_tags=platform_conflict, asset_ambiguity, priority_conflict, compliance_or_visual_trap, layout_space_pressure."
}
