{
  "case_id": "procedure_instruction_005",
  "task_type": "procedure_instruction",
  "web_policy": "closed_env",
  "target_image_type": "seedling_care_instruction_image",
  "difficulty": "medium",
  "env_files": [
    {
      "path": "env/seedling_care.pdf",
      "role": "Brochure-style source document with embedded public visual context",
      "format": "pdf",
      "origin": "mixed",
      "source_url": "https://commons.wikimedia.org/wiki/File:English_Garden_Path.jpg",
      "retrieved_at": "2026-06-19",
      "license_note": "Wikimedia Commons CC0 1.0 public-domain dedication; verify on the source page before reuse.",
      "conversion_note": "Case-specific text was combined with a cached public image and embedded in a natural PDF; the standalone image file is not exposed as an env file.",
      "reproducibility_note": "Generated by benchmark/scripts/expand_cases_to_five.py"
    }
  ],
  "source_policy": {
    "agent_visible_files": [
      "env/",
      "task.md"
    ],
    "evaluator_only_files": [
      "metadata.json",
      "expected_facts.json",
      "scoring_checklist.json"
    ],
    "web_usage_note": "Follow web_policy. Closed-env cases should be solved from cached env files only."
  },
  "notes": ""
}
