{
  "case_id": "design_specification_005",
  "task_type": "design_specification",
  "web_policy": "closed_env",
  "target_image_type": "instagram_story_wayfinding_image",
  "difficulty": "hard",
  "env_files": [
    {
      "path": "env/latest_update.md",
      "role": "Latest campaign update with authoritative copy, replacements, and priority order",
      "format": "md",
      "origin": "generated",
      "reproducibility_note": "Generated during design_specification difficulty optimization"
    },
    {
      "path": "env/platform_specs.txt",
      "role": "Current Instagram Story size, safe-area, hierarchy, density, and placement constraints",
      "format": "txt",
      "origin": "generated",
      "reproducibility_note": "Generated during design_specification difficulty optimization"
    },
    {
      "path": "env/visual_rules.json",
      "role": "Current brand palette, design rules, hero requirements, and forbidden styles",
      "format": "json",
      "origin": "generated",
      "reproducibility_note": "Generated during design_specification difficulty optimization"
    },
    {
      "path": "env/asset_manifest.json",
      "role": "Allowed current logo, hero, icon, badge, or helper assets",
      "format": "json",
      "origin": "generated",
      "reproducibility_note": "Generated during design_specification difficulty optimization"
    },
    {
      "path": "env/deprecated_assets.json",
      "role": "Deprecated copy, colors, claims, logos, templates, and plausible wrong assets that must not be active",
      "format": "json",
      "origin": "generated",
      "reproducibility_note": "Generated during design_specification difficulty optimization"
    },
    {
      "path": "env/brand_brief.md",
      "role": "Compact current brand context replacing the poorly rendered PDF guide",
      "format": "md",
      "origin": "generated",
      "reproducibility_note": "Generated during design_specification difficulty optimization"
    }
  ],
  "source_policy": {
    "agent_visible_files": [
      "env/",
      "task.md"
    ],
    "evaluator_only_files": [
      "metadata.json",
      "expected_facts.json",
      "scoring_checklist.json"
    ],
    "web_usage_note": "Closed-env case: solve only from env files and task.md; do not use the web."
  },
  "notes": "Lightly optimized design-specification-to-image case with six env files, no PDF dependency, latest-update priority conflict, Instagram Story constraints, current palette resolution, allowed assets, and deprecated exclusions."
}
