{
  "case_id": "state_change_005",
  "task_type": "state_change",
  "web_policy": "closed_env",
  "target_image_type": "current_release_announcement",
  "difficulty": "medium",
  "env_files": [
    {
      "path": "env/original_release.md",
      "role": "Superseded release note",
      "format": "md",
      "origin": "generated",
      "reproducibility_note": "Generated by benchmark/scripts/expand_cases_to_five.py"
    },
    {
      "path": "env/release_changes.md",
      "role": "Release change log",
      "format": "md",
      "origin": "generated",
      "reproducibility_note": "Generated by benchmark/scripts/expand_cases_to_five.py"
    },
    {
      "path": "env/release_status.csv",
      "role": "Current version status",
      "format": "csv",
      "origin": "generated",
      "reproducibility_note": "Generated by benchmark/scripts/expand_cases_to_five.py"
    }
  ],
  "source_policy": {
    "agent_visible_files": [
      "env/",
      "task.md"
    ],
    "evaluator_only_files": [
      "metadata.json",
      "expected_facts.json",
      "scoring_checklist.json"
    ],
    "web_usage_note": "Follow web_policy. Closed-env cases should be solved from cached env files only."
  },
  "notes": ""
}
