{
  "case_id": "data_insight_004",
  "task_type": "data_insight",
  "web_policy": "closed_env",
  "target_image_type": "subscription_retention_risk_infographic",
  "difficulty": "hard",
  "env_files": [
    {
      "path": "env/segment_panel.csv",
      "role": "Monthly subscription retention risk panel with actual records and answer-changing distractors",
      "format": "csv",
      "origin": "generated",
      "reproducibility_note": "Generated by data_insight_case_generator.py from deterministic panel seed data"
    },
    {
      "path": "env/segment_profiles.csv",
      "role": "Profile mapping for customer segment names, market region groups, scale denominators, and criticality",
      "format": "csv",
      "origin": "generated",
      "reproducibility_note": "Generated deterministic mapping file; contains no final results"
    },
    {
      "path": "env/retention_rules.json",
      "role": "Closed-env inclusion rules, periods, formulas, weights, thresholds, and tie-break order",
      "format": "json",
      "origin": "generated",
      "reproducibility_note": "Generated deterministic rules; contains formulas but no final answers"
    },
    {
      "path": "env/retention_notes.md",
      "role": "Analyst notes about closed periods, invalid records, and intended decision framing",
      "format": "md",
      "origin": "generated",
      "reproducibility_note": "Generated support note; contains no final answers"
    }
  ],
  "source_policy": {
    "agent_visible_files": [
      "env/",
      "task.md"
    ],
    "evaluator_only_files": [
      "metadata.json",
      "expected_facts.json",
      "scoring_checklist.json"
    ],
    "web_usage_note": "Closed-env case: web access is not allowed; solve from env files only."
  },
  "notes": "Generated hard data_insight case for subscription retention risk using multi-period CSV panel data, profile mapping, JSON rules, weighted normalized scoring, threshold counts, group aggregation, and distractor exclusion."
}
