{
  "case_id": "multi_source_fusion_002",
  "task_type": "multi_source_fusion",
  "web_policy": "web_required",
  "target_image_type": "tourism_social_campaign_image",
  "difficulty": "hard",
  "env_files": [
    {
      "path": "env/weather_summary.csv",
      "role": "Weekend weather options",
      "format": "csv",
      "origin": "generated",
      "reproducibility_note": "Generated by benchmark/scripts/generate_development_cases.py"
    },
    {
      "path": "env/venue_brief.pdf",
      "role": "Venue brief with embedded reference image and forbidden claims",
      "format": "pdf",
      "origin": "mixed",
      "reproducibility_note": "Regenerated by benchmark/scripts/repair_pilot_cases.py",
      "source_url": "https://commons.wikimedia.org/wiki/File:English_Garden_Path.jpg",
      "retrieved_at": "2026-06-19",
      "license_note": "Wikimedia Commons CC0 1.0 public-domain dedication; verify on the source page before reuse.",
      "conversion_note": "Original case text and rules were combined with a cached public Wikimedia image, then regenerated as a brochure-style PDF. The standalone image file is not exposed as an env file."
    },
    {
      "path": "env/audience.json",
      "role": "Audience and tone constraints",
      "format": "json",
      "origin": "generated",
      "reproducibility_note": "Generated by benchmark/scripts/generate_development_cases.py"
    },
    {
      "path": "env/campaign.yaml",
      "role": "Platform and objective",
      "format": "yaml",
      "origin": "generated",
      "reproducibility_note": "Generated by benchmark/scripts/generate_development_cases.py"
    }
  ],
  "source_policy": {
    "agent_visible_files": [
      "env/",
      "task.md"
    ],
    "evaluator_only_files": [
      "metadata.json",
      "expected_facts.json",
      "scoring_checklist.json"
    ],
    "web_usage_note": "Follow web_policy. Closed-env cases should be solved from cached env files only."
  },
  "notes": "Web search is required only for current Instagram feed size/aspect guidance."
}
