{
  "case_id": "state_change_002",
  "task_type": "state_change",
  "web_policy": "closed_env",
  "target_image_type": "current_transit_detour_poster",
  "difficulty": "medium",
  "env_files": [
    {
      "path": "env/old_notice.md",
      "role": "Superseded detour notice",
      "format": "md",
      "origin": "generated",
      "reproducibility_note": "Generated by benchmark/scripts/generate_development_cases.py"
    },
    {
      "path": "env/amendments.md",
      "role": "Amendment log with latest changes and cancellation",
      "format": "md",
      "origin": "generated",
      "reproducibility_note": "Generated by benchmark/scripts/generate_development_cases.py"
    },
    {
      "path": "env/active_routes.csv",
      "role": "Current active/cancelled route table",
      "format": "csv",
      "origin": "generated",
      "reproducibility_note": "Generated by benchmark/scripts/generate_development_cases.py"
    }
  ],
  "source_policy": {
    "agent_visible_files": [
      "env/",
      "task.md"
    ],
    "evaluator_only_files": [
      "metadata.json",
      "expected_facts.json",
      "scoring_checklist.json"
    ],
    "web_usage_note": "Follow web_policy. Closed-env cases should be solved from cached env files only."
  },
  "notes": ""
}
