{
  "case_id": "data_selection_008",
  "task_type": "data_selection",
  "web_policy": "closed_env",
  "target_image_type": "mobile_clinic_route_poster",
  "difficulty": "hard",
  "env_files": [
    {
      "path": "env/clinic_route.sqlite",
      "role": "SQLite source table of candidate objects for mobile clinic route poster with eligible rows and tempting distractors",
      "format": "sqlite",
      "origin": "generated",
      "reproducibility_note": "Generated by data_selection_case_generator.py from deterministic row data; contains no final answer key"
    },
    {
      "path": "env/route_rules.json",
      "role": "Selection filters, ranking order, top-N target, group limit, and tie-break rules",
      "format": "json",
      "origin": "generated",
      "reproducibility_note": "Generated deterministic rule file; contains rules but no final selected list"
    },
    {
      "path": "env/route_rules.sql",
      "role": "Human-readable rule reminder and distractor handling note",
      "format": "sql",
      "origin": "generated",
      "reproducibility_note": "Generated note file; repeats process constraints without listing final answers"
    }
  ],
  "source_policy": {
    "agent_visible_files": [
      "env/",
      "task.md"
    ],
    "evaluator_only_files": [
      "metadata.json",
      "expected_facts.json",
      "scoring_checklist.json"
    ],
    "web_usage_note": "Closed-env case: web access is not allowed; solve from env files only."
  },
  "notes": "Generated hard data_selection case for a mobile clinic route poster with multi-condition filtering, group caps, ranking, tie-breaks, and answer-changing distractors."
}
