{
  "case_id": "procedure_instruction_002",
  "task_type": "procedure_instruction",
  "web_policy": "closed_env",
  "target_image_type": "safety_setup_instruction_image",
  "difficulty": "medium",
  "env_files": [
    {
      "path": "env/safety_manual.pdf",
      "role": "Setup manual with embedded diagram and support-only distractor",
      "format": "pdf",
      "origin": "mixed",
      "reproducibility_note": "Regenerated by benchmark/scripts/repair_pilot_cases.py",
      "source_url": "https://commons.wikimedia.org/wiki/File:Safety_equipment_in_a_lab.jpg",
      "retrieved_at": "2026-06-19",
      "license_note": "Wikimedia Commons Creative Commons Attribution-ShareAlike 3.0; verify attribution details on the source page.",
      "conversion_note": "Original case text and rules were combined with a cached public Wikimedia image, then regenerated as a brochure-style PDF. The standalone image file is not exposed as an env file."
    },
    {
      "path": "env/quick_card.txt",
      "role": "Step count and priority cues",
      "format": "txt",
      "origin": "generated",
      "reproducibility_note": "Generated by benchmark/scripts/generate_development_cases.py"
    }
  ],
  "source_policy": {
    "agent_visible_files": [
      "env/",
      "task.md"
    ],
    "evaluator_only_files": [
      "metadata.json",
      "expected_facts.json",
      "scoring_checklist.json"
    ],
    "web_usage_note": "Follow web_policy. Closed-env cases should be solved from cached env files only."
  },
  "notes": ""
}
