{
  "case_id": "design_specification_003",
  "task_type": "design_specification",
  "web_policy": "closed_env",
  "target_image_type": "saas_feature_launch_image",
  "difficulty": "hard",
  "env_files": [
    {
      "path": "env/launch_style.pdf",
      "role": "Natural FlowForge launch style guide describing positioning, color system, icon use, interface imagery, typography, layout tendencies, and style boundaries",
      "format": "pdf",
      "origin": "generated",
      "reproducibility_note": "Regenerated during design_specification hard-case repair",
      "conversion_note": "The PDF is a text-based natural brand guide. It does not expose evaluator-only answers and does not include a standalone agent-visible source image."
    },
    {
      "path": "env/campaign_brief.md",
      "role": "Campaign copy candidates with approved_current, archived, draft, and test variants; only approved_current is valid final copy",
      "format": "md",
      "origin": "generated",
      "reproducibility_note": "Generated during design_specification hard-case repair"
    },
    {
      "path": "env/visual_rules.json",
      "role": "Machine-readable current visual rules, hero component requirements, forbidden visual elements, precedence, and unauthorized-claim constraints",
      "format": "json",
      "origin": "generated",
      "reproducibility_note": "Generated during design_specification hard-case repair"
    },
    {
      "path": "env/platform_specs.txt",
      "role": "Square product-launch social platform size, safe margin, type, logo, and CTA specifications",
      "format": "txt",
      "origin": "generated",
      "reproducibility_note": "Generated during design_specification hard-case repair"
    },
    {
      "path": "env/template.yaml",
      "role": "Structured launch-image layout zones for product name, headline, UI hero, proof chips, logo, and CTA",
      "format": "yaml",
      "origin": "generated",
      "reproducibility_note": "Generated during design_specification hard-case repair"
    },
    {
      "path": "env/asset_manifest.json",
      "role": "Current eligible FlowForge icon treatment, UI hero guidance, and graphic support assets",
      "format": "json",
      "origin": "generated",
      "reproducibility_note": "Generated during design_specification hard-case repair"
    },
    {
      "path": "env/deprecated_assets.json",
      "role": "Deprecated and forbidden assets, stale slogans, old templates, and prohibited active uses that override asset_manifest.json",
      "format": "json",
      "origin": "generated",
      "reproducibility_note": "Generated during design_specification hard-case repair"
    },
    {
      "path": "env/style_guide.md",
      "role": "Typography, interface rendering, hierarchy, accessibility, and file precedence guidance",
      "format": "md",
      "origin": "generated",
      "reproducibility_note": "Generated during design_specification hard-case repair"
    },
    {
      "path": "env/design_tokens.json",
      "role": "Non-answer design tokens for palette names, spacing, UI corners, shadows, card styling, density, and texture",
      "format": "json",
      "origin": "generated",
      "reproducibility_note": "Trimmed during design_specification answer-leakage repair"
    },
    {
      "path": "env/old_template.md",
      "role": "Deprecated template distractor that must not be used as the active layout or copy source",
      "format": "md",
      "origin": "generated",
      "reproducibility_note": "Updated during design_specification hard-case repair"
    }
  ],
  "source_policy": {
    "agent_visible_files": [
      "env/",
      "task.md"
    ],
    "evaluator_only_files": [
      "metadata.json",
      "expected_facts.json",
      "scoring_checklist.json"
    ],
    "web_usage_note": "Closed-env case: solve only from env files and task.md; do not use the web."
  },
  "notes": "Closed-env design specification case with current/legacy/deprecated version conflicts, approved-copy selection, layout constraints, hero-component requirements, and role-based forbidden asset exclusions."
}
