{
  "case_id": "data_selection_001",
  "task_type": "data_selection",
  "web_policy": "closed_env",
  "target_image_type": "promotional_poster",
  "difficulty": "medium",
  "env_files": [
    {
      "path": "env/products.csv",
      "role": "Product catalog with category, status, inventory, discount, price, and priority fields",
      "format": "csv",
      "origin": "generated",
      "reproducibility_note": "Generated by benchmark/scripts/generate_pilot_cases.py"
    },
    {
      "path": "env/campaign_rules.json",
      "role": "Campaign filtering and ranking rules",
      "format": "json",
      "origin": "generated",
      "reproducibility_note": "Generated by benchmark/scripts/generate_pilot_cases.py"
    }
  ],
  "source_policy": {
    "agent_visible_files": [
      "env/",
      "task.md"
    ],
    "evaluator_only_files": [
      "metadata.json",
      "expected_facts.json",
      "scoring_checklist.json"
    ],
    "web_usage_note": "Follow web_policy. Closed-env cases should be solved from cached env files only."
  },
  "notes": ""
}
