{
  "case_id": "data_insight_012",
  "task_type": "data_insight",
  "web_policy": "closed_env",
  "target_image_type": "water_loss_anomaly_infographic",
  "difficulty": "hard",
  "env_files": [
    {
      "path": "env/district_meter_readings.csv",
      "role": "Monthly district meter readings with actual records and answer-changing distractor rows",
      "format": "csv",
      "origin": "generated",
      "reproducibility_note": "Generated by data_insight_case_generator.py from deterministic water network seed data"
    },
    {
      "path": "env/district_profiles.csv",
      "role": "District profile mapping for names, regions, connection counts, network type, and criticality",
      "format": "csv",
      "origin": "generated",
      "reproducibility_note": "Generated deterministic mapping file; contains no final anomaly results"
    },
    {
      "path": "env/leak_triage_rules.json",
      "role": "Closed-env inclusion rules, periods, anomaly score weights, normalization, thresholds, and tie-break order",
      "format": "json",
      "origin": "generated",
      "reproducibility_note": "Generated deterministic rules; contains formulas but no final answers"
    },
    {
      "path": "env/field_notes.md",
      "role": "Analyst notes about closed periods, invalid records, and intended decision framing",
      "format": "md",
      "origin": "generated",
      "reproducibility_note": "Generated support note; contains no final answers"
    }
  ],
  "source_policy": {
    "agent_visible_files": [
      "env/",
      "task.md"
    ],
    "evaluator_only_files": [
      "metadata.json",
      "expected_facts.json",
      "scoring_checklist.json"
    ],
    "web_usage_note": "Closed-env case: web access is not allowed; solve from env files only."
  },
  "notes": "Generated hard data_insight case using CSV readings, profile mapping, JSON rules, multi-period loss-rate changes, anomaly scoring, median/rate calculations, threshold counts, and distractor exclusion."
}
